{
  "$schema": "orchestration/schemas/spec.schema.json",
  "schema_version": 1,
  "name": "agent-sample",
  "version": 2,
  "status": "frozen",
  "commit": "7c1d0aa",
  "reason": "golden fixture: a frozen revision exercising lineage, retirement and non-ok statuses",
  "previous_versions": [
    { "v": 1, "file": "spec.v1.json", "date": "2026-08-24", "commit": "a1b2c3d", "reason": "initial fixture" }
  ],
  "intent": {
    "id": "INT",
    "status": "ok",
    "text": "A fixture spec that exercises every section the validator inspects, so a regression in any invariant has something to fail against."
  },
  "scope": [
    { "id": "SC1", "status": "ok", "kind": "in", "text": "One node in every section, with the shapes the schema requires." },
    { "id": "SC2", "status": "ok", "kind": "out", "text": "Any resemblance to a real crew role; this fixture is structural only." },
    { "id": "SC3", "status": "new", "kind": "in", "text": "The revision path: lineage entries, retired ids, and statuses other than ok.", "note": "v2 added so the frozen gates and the registry have a fixture" }
  ],
  "constraints": [
    { "id": "C1", "status": "changed", "text": "Stays warning-free so a test can assert on a clean run, in both v1 and v2.", "note": "widened to cover the frozen fixture" }
  ],
  "interfaces": [
    { "id": "I1", "status": "ok", "name": "validate-spec", "reuse": "validate-spec.mjs", "text": "validate-spec.mjs <file> [--schema <f>] [--for-freeze] -> exit 0 | 2" },
    { "id": "I2", "status": "ok", "name": "fixture-tree", "reuse": null, "text": "test/fixtures/<name>/spec.v<n>.json" }
  ],
  "behaviours": [
    { "id": "B1", "status": "ok", "text": "Validating this file unmodified exits 0 with no warnings." },
    { "id": "B3", "status": "new", "text": "A retired id reappearing anywhere in the live arrays is rejected.", "note": "B2 retired; its ground is now covered case-by-case" }
  ],
  "edges": [
    { "id": "E1", "status": "ok", "text": "The schema file is missing or unreadable: the validator exits non-zero rather than reporting the spec valid." },
    { "id": "E2", "status": "ok", "text": "A section is absent entirely: the schema's required list rejects the file before any invariant runs." }
  ],
  "decisions": [
    { "id": "D1", "status": "ok", "text": "Fixtures are mutated in a temp directory rather than stored one-per-case, so a case is a diff and not a duplicate file." },
    { "id": "D2", "status": "new", "text": "previous_versions is ordered oldest first, matching the schema description and invariant 6; the prose in spec-versioning.md was corrected to agree.", "note": "resolved a contradiction between the doc and the two executable artefacts" }
  ],
  "verification": {
    "id": "VER",
    "status": "ok",
    "text": "node test/run.mjs exits 0 with every case reported pass."
  },
  "acceptance": {
    "id": "ACC",
    "status": "ok",
    "text": "Every coded invariant in validate-spec.mjs has at least one case that fails without it."
  },
  "open_questions": [],
  "retired": [
    { "id": "B2", "at": 2, "text": "Mutating one field of this file raises the invariant that field belongs to, and no other.", "note": "replaced by B3; the one-mutation rule moved into the runner and is no longer a spec behaviour" }
  ]
}
